{
  "id": "proj_benchmark_b_xray_compositing",
  "schemaVersion": "1.0.0",
  "revision": 1,
  "title": "Benchmark B - Multi-Track X-Ray Compositing & Difference Blending",
  "canvas": {
    "width": 1080,
    "height": 1920,
    "aspectRatio": "9:16",
    "backgroundColor": "#000000"
  },
  "timebase": {
    "fps": {
      "numerator": 60,
      "denominator": 1
    },
    "ticksPerSecond": 120000,
    "durationTicks": 960000,
    "endpointConvention": "half-open"
  },
  "assets": [
    {
      "id": "raw_footage_main",
      "type": "video",
      "src": "Aditya Rikhari - Raatein Guzaari [qbvAmlKhWQQ].mp4"
    },
    {
      "id": "sfx_shutter",
      "type": "audio",
      "src": "assets/sfx/archive_replaced/20_shutter_original.wav"
    }
  ],
  "tracks": [
    {
      "id": "track_base_footage",
      "name": "Base Source Video Track",
      "kind": "visual",
      "zIndex": 10,
      "muted": false,
      "locked": false
    },
    {
      "id": "track_xray_layer",
      "name": "X-Ray Inverted Difference Composite",
      "kind": "visual",
      "zIndex": 20,
      "muted": false,
      "locked": false
    },
    {
      "id": "track_sfx",
      "name": "Mechanical Hits & SFX",
      "kind": "audio",
      "zIndex": 0,
      "muted": false,
      "locked": false
    }
  ],
  "clips": [
    {
      "id": "clip_source_base",
      "trackId": "track_base_footage",
      "type": "video",
      "startTick": 0,
      "durationTicks": 960000,
      "source": {
        "assetId": "raw_footage_main",
        "trimInTick": 120000,
        "trimOutTick": 1080000
      },
      "transform": {
        "x": 540,
        "y": 960,
        "scaleX": 1.0,
        "scaleY": 1.0,
        "opacity": 1.0
      }
    },
    {
      "id": "clip_source_xray",
      "trackId": "track_xray_layer",
      "type": "video",
      "startTick": 240000,
      "durationTicks": 480000,
      "source": {
        "assetId": "raw_footage_main",
        "trimInTick": 360000,
        "trimOutTick": 840000
      },
      "transform": {
        "x": 540,
        "y": 960,
        "scaleX": 1.05,
        "scaleY": 1.05,
        "opacity": 0.85
      },
      "effects": [
        {
          "type": "invert",
          "parameters": {
            "amount": 1.0
          }
        },
        {
          "type": "contrast",
          "parameters": {
            "factor": 1.75
          }
        },
        {
          "type": "blendMode",
          "parameters": {
            "mode": "difference"
          }
        }
      ]
    },
    {
      "id": "clip_shutter_hit",
      "trackId": "track_sfx",
      "type": "audio",
      "startTick": 240000,
      "durationTicks": 60000,
      "source": {
        "assetId": "sfx_shutter",
        "trimInTick": 0,
        "trimOutTick": 60000
      },
      "audio": {
        "volume": 0.95
      }
    }
  ],
  "animations": [
    {
      "clipId": "clip_source_xray",
      "property": "transform.opacity",
      "keyframes": [
        { "offsetTick": 0, "value": 0.0, "easing": "power2.out" },
        { "offsetTick": 30000, "value": 0.85, "easing": "linear" },
        { "offsetTick": 450000, "value": 0.85, "easing": "linear" },
        { "offsetTick": 480000, "value": 0.0, "easing": "power2.out" }
      ]
    }
  ]
}
